,Word,Definition
0,Direction,"The alignment or positioning of something with respect to a reference point, which is a key aspect of orientation."
1,Navigation,"The process of planning and following a course or route, often involving orientation skills to find one's way."
2,Compass,"A navigational instrument that helps determine direction, providing a reference for orientation."
3,Map,A visual representation of geographic or spatial information used for orientation and navigation.
4,North,One of the cardinal directions and a critical point of reference in orientation.
5,Landmarks,"Prominent and recognizable features in the environment used for orientation, such as mountains, buildings, or distinctive natural formations."
6,Orientation Session,"An organized event or program designed to familiarize individuals with a new environment, workplace, or educational institution."
7,Magnetic Field,"The region around a magnetic object, such as the Earth's magnetic field, which plays a role in orientation using a compass."
8,Geographic Coordinates,"A system of latitude and longitude used to specify points on the Earth's surface, aiding in geographical orientation."
9,Wayfinding,"The process of using visual cues, signage, and other information to navigate and orient oneself within a built environment."
10,Topography,"The physical features and layout of the land, including elevation and terrain, which influence orientation."
11,GPS (Global Positioning System),A satellite-based navigation system that provides precise location and orientation information.
12,Cardinal Directions,"The four primary compass points of north, south, east, and west, serving as essential references in orientation."
13,Orientation Sensor,"A device, often found in smartphones, that detects the device's orientation in space, providing data for apps and services."
14,Cultural Orientation,"The process of learning and adapting to the customs, norms, and values of a specific culture or community."
